
<?xml version="1.0" encoding="UTF-8"?>
<?xml-stylesheet type="text/xsl" href="spa_salon.xsl"?>
<!DOCTYPE spaSalon>
<spaSalon xmlns:xsi="http://www.w3.org/2001/XMLSchema-instance"
          xsi:noNamespaceSchemaLocation="SpaSalon.xsd">
    <services>
        <service>
            <id>S001</id>
            <name>Aromatherapy Massage</name>
            <description>Relax with a soothing aromatherapy massage using essential oils.</description>
            <price>100.00</price>
            <availability>Available</availability>
            <duration>60 minutes</duration>
            <departureDate>2024-08-20</departureDate>
            <destination>Massage Room 1</destination>
        </service>
        <service>
            <id>S002</id>
            <name>Deep Cleansing Facial</name>
            <description>Revitalize your skin with a deep cleansing facial treatment.</description>
            <price>90.00</price>
            <availability>Limited Availability</availability>
            <duration>75 minutes</duration>
            <departureDate>2024-08-22</departureDate>
            <destination>Facial Room 2</destination>
        </service>
        <service>
            <id>S003</id>
            <name>Luxury Pedicure</name>
            <description>Indulge in a luxurious pedicure with premium products.</description>
            <price>60.00</price>
            <availability>Available</availability>
            <duration>50 minutes</duration>
            <departureDate>2024-08-23</departureDate>
            <destination>Nail Studio 3</destination>
        </service>
        <service>
            <id>S004</id>
            <name>Hot Stone Therapy</name>
            <description>Experience the therapeutic effects of heated stones in a full-body massage.</description>
            <price>120.00</price>
            <availability>Available</availability>
            <duration>90 minutes</duration>
            <departureDate>2024-08-25</departureDate>
            <destination>Massage Room 2</destination>
        </service>
        <service>
            <id>S005</id>
            <name>Reflexology</name>
            <description>Relieve stress and improve circulation with targeted foot reflexology.</description>
            <price>75.00</price>
            <availability>Limited Availability</availability>
            <duration>45 minutes</duration>
            <departureDate>2024-08-26</departureDate>
            <destination>Reflexology Room 1</destination>
        </service>
        <service>
            <id>S006</id>
            <name>Body Scrub</name>
            <description>Exfoliate and rejuvenate your skin with a luxurious body scrub treatment.</description>
            <price>85.00</price>
            <availability>Available</availability>
            <duration>60 minutes</duration>
            <departureDate>2024-08-27</departureDate>
            <destination>Body Treatment Room 1</destination>
        </service>
        <service>
            <id>S007</id>
            <name>Haircut and Styling</name>
            <description>Enjoy a fresh haircut and professional styling from our expert stylists.</description>
            <price>50.00</price>
            <availability>Available</availability>
            <duration>45 minutes</duration>
            <departureDate>2024-08-28</departureDate>
            <destination>Salon Area 1</destination>
        </service>
        <service>
            <id>S008</id>
            <name>Manicure</name>
            <description>Get beautifully manicured nails with our deluxe manicure service.</description>
            <price>40.00</price>
            <availability>Available</availability>
            <duration>30 minutes</duration>
            <departureDate>2024-08-29</departureDate>
            <destination>Nail Studio 2</destination>
        </service>
    </services>
</spaSalon>